{
  "schema_version": "1.0",
  "tenant_id": "ten_demo",
  "correlation_id": "corr_4c21f9",
  "decision_id": "dec_8R4",
  "intent_id": "int_01J9X3",
  "intent_hash": "sha256:9999999999999999999999999999999999999999999999999999999999999999",
  "outcome": "WAIT",
  "reason_codes": [
    "fin.reason.source_retry_after"
  ],
  "authority": {
    "technical": "PASS",
    "policy": "PASS",
    "business": "NOT_EVALUATED"
  },
  "evidence_snapshot_id": "evs_51A",
  "policy_version": "fin.pol@3.2",
  "pack_version": "fintech@1.0.0",
  "evidence_freshness": [
    {
      "source": "fin.src.settlement",
      "age_seconds": 42,
      "effective_limit_seconds": 300,
      "limit_set_by": "TRUST_PROFILE"
    }
  ],
  "evaluated_at": "2026-10-01T09:47:04.210Z",
  "sig": {
    "key_id": "trust-2026-10",
    "value": "c2ln"
  },
  "reevaluate_at": "2026-10-01T09:52:04Z"
}
